{
  "after_revision": 7,
  "before_revision": 6,
  "details": {
    "lease": {
      "created_at": "2026-08-30T21:39:12Z",
      "expires_at": "2026-08-30T23:39:12Z",
      "kit_version": "2.1.0",
      "owner": "example-builder",
      "schema_version": "2.1",
      "state_revision": 6,
      "task_id": "3.1.2"
    },
    "note": null,
    "receipt_ids": [
      "2afafaccf3451222b4c08d09884a2b5aecfbf35bd4a7e6089583a7bc7ca4e795"
    ]
  },
  "id": "7b2dbc1d8744416493a064628c1bd9f0",
  "kit_version": "2.1.0",
  "operation": "finish",
  "recorded_at": "2026-08-30T21:39:12Z",
  "schema_version": "2.1",
  "status": "committed",
  "task_id": "3.1.2"
}
